{
  "decision_status": "draft",
  "executable": {
    "bytes": 5490456,
    "path": "/home/shijie20/CodeSpace/ChatScene/chatscene/bin/python-frozen",
    "sha256": "298a9e830ed52f36c299427565485d717d1ce0179c0597cc16560513eb780b06"
  },
  "locked_dependencies": [
    {
      "name": "annotated-types",
      "version": "0.7.0"
    },
    {
      "name": "antlr4-python3-runtime",
      "version": "4.13.2"
    },
    {
      "name": "anyio",
      "version": "4.5.2"
    },
    {
      "name": "argon2-cffi",
      "version": "25.1.0"
    },
    {
      "name": "argon2-cffi-bindings",
      "version": "21.2.0"
    },
    {
      "name": "arrow",
      "version": "1.4.0"
    },
    {
      "name": "asttokens",
      "version": "3.0.2"
    },
    {
      "name": "async-lru",
      "version": "2.0.4"
    },
    {
      "name": "attrs",
      "version": "25.3.0"
    },
    {
      "name": "babel",
      "version": "2.18.0"
    },
    {
      "name": "backcall",
      "version": "0.2.0"
    },
    {
      "name": "backports-zoneinfo",
      "version": "0.2.1"
    },
    {
      "name": "beautifulsoup4",
      "version": "4.15.0"
    },
    {
      "name": "bleach",
      "version": "6.1.0"
    },
    {
      "name": "blessed",
      "version": "1.47.0"
    },
    {
      "name": "certifi",
      "version": "2026.6.17"
    },
    {
      "name": "cffi",
      "version": "1.17.1"
    },
    {
      "name": "charset-normalizer",
      "version": "3.4.9"
    },
    {
      "name": "click",
      "version": "8.1.8"
    },
    {
      "name": "cloudpickle",
      "version": "3.1.2"
    },
    {
      "name": "comm",
      "version": "0.2.3"
    },
    {
      "name": "contourpy",
      "version": "1.1.1"
    },
    {
      "name": "cpprb",
      "version": "10.7.0"
    },
    {
      "name": "cycler",
      "version": "0.12.1"
    },
    {
      "name": "cython",
      "version": "0.29.37"
    },
    {
      "name": "debugpy",
      "version": "1.8.21"
    },
    {
      "name": "decorator",
      "version": "5.1.1"
    },
    {
      "name": "defusedxml",
      "version": "0.7.1"
    },
    {
      "name": "distro",
      "version": "1.9.0"
    },
    {
      "name": "dotmap",
      "version": "1.3.30"
    },
    {
      "name": "ephem",
      "version": "4.1.4"
    },
    {
      "name": "exceptiongroup",
      "version": "1.3.1"
    },
    {
      "name": "executing",
      "version": "2.2.1"
    },
    {
      "name": "fastjsonschema",
      "version": "2.21.2"
    },
    {
      "name": "filelock",
      "version": "3.16.1"
    },
    {
      "name": "fonttools",
      "version": "4.57.0"
    },
    {
      "name": "fqdn",
      "version": "1.5.1"
    },
    {
      "name": "fsspec",
      "version": "2025.3.0"
    },
    {
      "name": "gpustat",
      "version": "1.1.1"
    },
    {
      "name": "gym",
      "version": "0.23.1"
    },
    {
      "name": "gym-notices",
      "version": "0.1.0"
    },
    {
      "name": "h11",
      "version": "0.16.0"
    },
    {
      "name": "hf-xet",
      "version": "1.5.1"
    },
    {
      "name": "httpcore",
      "version": "1.0.9"
    },
    {
      "name": "httpx",
      "version": "0.28.1"
    },
    {
      "name": "huggingface-hub",
      "version": "0.25.2"
    },
    {
      "name": "idna",
      "version": "3.15"
    },
    {
      "name": "imageio",
      "version": "2.35.1"
    },
    {
      "name": "imageio-ffmpeg",
      "version": "0.5.1"
    },
    {
      "name": "importlib-metadata",
      "version": "8.5.0"
    },
    {
      "name": "importlib-resources",
      "version": "6.4.5"
    },
    {
      "name": "iniconfig",
      "version": "2.1.0"
    },
    {
      "name": "ipykernel",
      "version": "6.29.5"
    },
    {
      "name": "ipython",
      "version": "8.12.3"
    },
    {
      "name": "ipywidgets",
      "version": "8.1.8"
    },
    {
      "name": "isoduration",
      "version": "20.11.0"
    },
    {
      "name": "jedi",
      "version": "0.19.2"
    },
    {
      "name": "jinja2",
      "version": "3.1.6"
    },
    {
      "name": "jinxed",
      "version": "2.1.0"
    },
    {
      "name": "jiter",
      "version": "0.9.1"
    },
    {
      "name": "joblib",
      "version": "1.2.0"
    },
    {
      "name": "json5",
      "version": "0.15.0"
    },
    {
      "name": "jsonpointer",
      "version": "3.0.0"
    },
    {
      "name": "jsonschema",
      "version": "4.23.0"
    },
    {
      "name": "jsonschema-specifications",
      "version": "2023.12.1"
    },
    {
      "name": "jupyter",
      "version": "1.1.1"
    },
    {
      "name": "jupyter-client",
      "version": "8.6.3"
    },
    {
      "name": "jupyter-console",
      "version": "6.6.3"
    },
    {
      "name": "jupyter-core",
      "version": "5.8.1"
    },
    {
      "name": "jupyter-events",
      "version": "0.10.0"
    },
    {
      "name": "jupyter-lsp",
      "version": "2.3.1"
    },
    {
      "name": "jupyter-server",
      "version": "2.14.2"
    },
    {
      "name": "jupyter-server-terminals",
      "version": "0.5.4"
    },
    {
      "name": "jupyterlab",
      "version": "4.3.8"
    },
    {
      "name": "jupyterlab-pygments",
      "version": "0.3.0"
    },
    {
      "name": "jupyterlab-server",
      "version": "2.28.0"
    },
    {
      "name": "jupyterlab-widgets",
      "version": "3.0.16"
    },
    {
      "name": "kiwisolver",
      "version": "1.4.7"
    },
    {
      "name": "mapbox-earcut",
      "version": "1.0.1"
    },
    {
      "name": "markupsafe",
      "version": "2.1.5"
    },
    {
      "name": "matplotlib",
      "version": "3.5.3"
    },
    {
      "name": "matplotlib-inline",
      "version": "0.1.7"
    },
    {
      "name": "mistune",
      "version": "3.3.3"
    },
    {
      "name": "moviepy",
      "version": "1.0.3"
    },
    {
      "name": "nbclient",
      "version": "0.10.1"
    },
    {
      "name": "nbconvert",
      "version": "7.16.6"
    },
    {
      "name": "nbformat",
      "version": "5.10.4"
    },
    {
      "name": "nest-asyncio",
      "version": "1.6.0"
    },
    {
      "name": "networkx",
      "version": "3.1"
    },
    {
      "name": "nltk",
      "version": "3.9.1"
    },
    {
      "name": "notebook",
      "version": "7.3.3"
    },
    {
      "name": "notebook-shim",
      "version": "0.2.4"
    },
    {
      "name": "numpy",
      "version": "1.21.6"
    },
    {
      "name": "nvidia-ml-py",
      "version": "13.610.43"
    },
    {
      "name": "openai",
      "version": "2.2.0"
    },
    {
      "name": "opencv-python",
      "version": "4.7.0.72"
    },
    {
      "name": "overrides",
      "version": "7.7.0"
    },
    {
      "name": "packaging",
      "version": "26.2"
    },
    {
      "name": "pandas",
      "version": "1.5.3"
    },
    {
      "name": "pandocfilters",
      "version": "1.5.1"
    },
    {
      "name": "parso",
      "version": "0.8.7"
    },
    {
      "name": "pexpect",
      "version": "4.9.0"
    },
    {
      "name": "pickleshare",
      "version": "0.7.5"
    },
    {
      "name": "pillow",
      "version": "9.5.0"
    },
    {
      "name": "pkgutil-resolve-name",
      "version": "1.3.10"
    },
    {
      "name": "platformdirs",
      "version": "4.3.6"
    },
    {
      "name": "pluggy",
      "version": "1.5.0"
    },
    {
      "name": "proglog",
      "version": "0.1.12"
    },
    {
      "name": "prometheus-client",
      "version": "0.21.1"
    },
    {
      "name": "prompt-toolkit",
      "version": "3.0.52"
    },
    {
      "name": "psutil",
      "version": "7.2.2"
    },
    {
      "name": "ptyprocess",
      "version": "0.7.0"
    },
    {
      "name": "pure-eval",
      "version": "0.2.3"
    },
    {
      "name": "pycocotools",
      "version": "2.0.6"
    },
    {
      "name": "pycparser",
      "version": "2.23"
    },
    {
      "name": "pydantic",
      "version": "2.10.6"
    },
    {
      "name": "pydantic-core",
      "version": "2.27.2"
    },
    {
      "name": "pygame",
      "version": "2.3.0"
    },
    {
      "name": "pygments",
      "version": "2.19.2"
    },
    {
      "name": "pyparsing",
      "version": "3.1.4"
    },
    {
      "name": "pytest",
      "version": "8.3.5"
    },
    {
      "name": "python-dateutil",
      "version": "2.9.0.post0"
    },
    {
      "name": "python-json-logger",
      "version": "4.0.0"
    },
    {
      "name": "pytz",
      "version": "2026.2"
    },
    {
      "name": "pywavelets",
      "version": "1.4.1"
    },
    {
      "name": "pyyaml",
      "version": "6.0"
    },
    {
      "name": "pyzmq",
      "version": "27.1.0"
    },
    {
      "name": "referencing",
      "version": "0.35.1"
    },
    {
      "name": "regex",
      "version": "2024.11.6"
    },
    {
      "name": "requests",
      "version": "2.32.4"
    },
    {
      "name": "rfc3339-validator",
      "version": "0.1.4"
    },
    {
      "name": "rfc3986-validator",
      "version": "0.1.1"
    },
    {
      "name": "rpds-py",
      "version": "0.20.1"
    },
    {
      "name": "safebench",
      "version": "1.0.0"
    },
    {
      "name": "safetensors",
      "version": "0.5.3"
    },
    {
      "name": "scenic",
      "version": "2.1.0b4"
    },
    {
      "name": "scikit-image",
      "version": "0.19.3"
    },
    {
      "name": "scikit-learn",
      "version": "1.3.2"
    },
    {
      "name": "scipy",
      "version": "1.10.1"
    },
    {
      "name": "seaborn",
      "version": "0.12.2"
    },
    {
      "name": "send2trash",
      "version": "2.1.0"
    },
    {
      "name": "sentence-transformers",
      "version": "2.2.1"
    },
    {
      "name": "sentencepiece",
      "version": "0.2.0"
    },
    {
      "name": "setgpu",
      "version": "0.0.7"
    },
    {
      "name": "setuptools",
      "version": "75.3.4"
    },
    {
      "name": "shapely",
      "version": "1.8.5"
    },
    {
      "name": "six",
      "version": "1.17.0"